{
  "schema_version": 1,
  "source_id": "fde-roadmap",
  "source_repository": "https://github.com/HubertRonald/fde-roadmap",
  "source_mode": "snapshot_sync",
  "requested_ref": "v0.1.0",
  "resolved_sha": "f896c19d182f8df03918f2c73a402e27a80ded16",
  "source_scopes": [
    "README.md",
    "CHANGELOG.md",
    "CITATION.md",
    "CONTRIBUTING.md",
    "docs/sources-and-provenance.md",
    "docs/visual-rationale.md",
    "SOURCES.yml",
    "LICENSE",
    "src/img/fde-core-tradeoffs.png",
    "src/img/fde-delivery-loop.png",
    "src/img/fde-learning-path.png",
    "src/img/fde-roadmap-overview.png",
    "src/img/fde-roadmap-stages.png",
    "src/img/fde-role-comparison.png",
    "src/img/fde-skill-pillars.png"
  ],
  "generated_targets": [
    "docs/technical-docs/fde-roadmap/guide.md",
    "docs/technical-docs/fde-roadmap/reference/**",
    "docs/technical-docs/fde-roadmap/assets/**"
  ],
  "sync_strategy": "git_clone_transform",
  "sync_adapter": "fde_roadmap_v1"
}
